{
 "schema": "pqc/script@1",
 "episode_id": "C01-E006",
 "cold_open": [],
 "scenes": [
  {
   "id": "s1",
   "cues": [
    {
     "op": "narrate",
     "text": "A hollow south of the fork, after midnight. An old ring of stones becomes a fire. The three dead cores sleep in Brannoc's cloak."
    },
    {
     "op": "say",
     "speaker": "brannoc",
     "text": "Two ways in. One way out, if it comes to it. Good enough."
    },
    {
     "op": "say",
     "speaker": "oriel",
     "text": "Our first fire, the four of us. Someone should say something.",
     "emote": "smile"
    },
    {
     "op": "say",
     "speaker": "tamsin",
     "text": "Something. There. Can we eat now?"
    },
    {
     "op": "face",
     "actor": "ilsevel",
     "facing": "left"
    },
    {
     "op": "narrate",
     "text": "Ilsevel scrapes the moss from a squat old stone at the edge of the hollow and leans close to the carving."
    },
    {
     "op": "check",
     "id": "c2"
    },
    {
     "op": "say",
     "speaker": "ilsevel",
     "text": "A Lamplighter way-marker. Here is the Order's sign, and here the old miles. This stone marked the road before the Lantern Road was laid.",
     "emote": "exclaim"
    },
    {
     "op": "say",
     "speaker": "ilsevel",
     "text": "The road moved. The stone stayed."
    },
    {
     "op": "say",
     "speaker": "brannoc",
     "text": "Stones do."
    },
    {
     "op": "say",
     "speaker": "oriel",
     "text": "Three cores. Three villages somewhere with a dark road tonight, and no idea why."
    },
    {
     "op": "say",
     "speaker": "brannoc",
     "text": "Then we take them back. What's done with a dead one?"
    },
    {
     "op": "say",
     "speaker": "ilsevel",
     "text": "Technically, a core is rekindled at a temple altar, by a Lamplighter of the second rank. I am of the fourth."
    },
    {
     "op": "say",
     "speaker": "tamsin",
     "text": "Professor, is that a long way of saying you can't?"
    },
    {
     "op": "say",
     "speaker": "ilsevel",
     "text": "It is a long way of saying I have never been allowed to try."
    },
    {
     "op": "say",
     "speaker": "oriel",
     "text": "Father Tobin's altar has never once gone out. Would it do?"
    },
    {
     "op": "say",
     "speaker": "ilsevel",
     "text": "I do not know. That is the honest answer. I would like to find out."
    },
    {
     "op": "move",
     "actor": "ilsevel",
     "to": [
      7,
      22
     ],
     "face": "down",
     "wait": false
    },
    {
     "op": "move",
     "actor": "tamsin",
     "to": [
      6,
      21
     ],
     "face": "down"
    },
    {
     "op": "narrate",
     "text": "Tamsin sits down with her back against the old stone."
    },
    {
     "op": "narrate",
     "text": "At her throat, the plain iron key on its cord begins to hum: one low note, felt more than heard."
    },
    {
     "op": "emote",
     "actor": "tamsin",
     "emote": "shock"
    },
    {
     "op": "narrate",
     "text": "Nobody else looks up. Tamsin closes her hand around the key, gets up, and moves to the far side of the fire without a word."
    },
    {
     "op": "move",
     "actor": "tamsin",
     "to": [
      10,
      24
     ],
     "face": "left"
    },
    {
     "op": "say",
     "speaker": "oriel",
     "text": "Tamsin? You've gone pale.",
     "emote": "question"
    },
    {
     "op": "say",
     "speaker": "tamsin",
     "text": "Smoke in my eyes, Sunshine. Wrong side of the fire.",
     "emote": "sweat"
    }
   ]
  },
  {
   "id": "s2",
   "cues": [
    {
     "op": "narrate",
     "text": "Later. Oriel sleeps. Brannoc keeps the edge of the hollow."
    },
    {
     "op": "narrate",
     "text": "Ilsevel sits upright, notebook open on her knees, in the half-waking trance elves have instead of sleep."
    },
    {
     "op": "move",
     "actor": "brannoc",
     "to": [
      13,
      25
     ],
     "face": "right",
     "wait": false
    },
    {
     "op": "move",
     "actor": "tamsin",
     "to": [
      8,
      22
     ],
     "face": "left"
    },
    {
     "op": "narrate",
     "text": "Tamsin has never been able to leave a closed book alone, any more than a locked box."
    },
    {
     "op": "check",
     "id": "c1"
    },
    {
     "op": "narrate",
     "text": "The notebook leaves Ilsevel's knees the way a leaf leaves a branch. Ilsevel does not stir."
    },
    {
     "op": "say",
     "speaker": "tamsin",
     "text": "'T.M. Velvet thread; lies about it. Practised hands.' Fair, Professor. Fair."
    },
    {
     "op": "say",
     "speaker": "tamsin",
     "text": "'Gave the boy a honey cake when she thought no one was looking.'"
    },
    {
     "op": "emote",
     "actor": "tamsin",
     "emote": "dots"
    },
    {
     "op": "narrate",
     "text": "Tamsin reads that line twice. Then she slides the notebook back exactly as it was, with a sprig of heather between the pages."
    },
    {
     "op": "emote",
     "actor": "pell",
     "emote": "question"
    }
   ]
  },
  {
   "id": "s3",
   "cues": [
    {
     "op": "camera",
     "to": [
      11,
      24
     ],
     "duration": 1.5
    },
    {
     "op": "narrate",
     "text": "First watch. Brannoc sits at the edge of the firelight with his shield across his knees."
    },
    {
     "op": "move",
     "actor": "oriel",
     "to": [
      12,
      25
     ],
     "face": "right"
    },
    {
     "op": "say",
     "speaker": "oriel",
     "text": "I can't sleep. May I sit?"
    },
    {
     "op": "say",
     "speaker": "brannoc",
     "text": "Log's big enough."
    },
    {
     "op": "say",
     "speaker": "brannoc",
     "text": "Two ways in."
    },
    {
     "op": "say",
     "speaker": "oriel",
     "text": "You said. Twice."
    },
    {
     "op": "say",
     "speaker": "brannoc",
     "text": "Counting helps."
    },
    {
     "op": "say",
     "speaker": "oriel",
     "text": "Helps with what?"
    },
    {
     "op": "say",
     "speaker": "brannoc",
     "text": "...Counting."
    },
    {
     "op": "narrate",
     "text": "In the firelight Oriel sees it: under the grey paint on his shield, the faint raised outline of an anvil."
    },
    {
     "op": "narrate",
     "text": "His thumb is tracing it, and he doesn't know he's doing it."
    },
    {
     "op": "say",
     "speaker": "oriel",
     "text": "There's something under the paint."
    },
    {
     "op": "say",
     "speaker": "brannoc",
     "text": "Old paint."
    },
    {
     "op": "say",
     "speaker": "oriel",
     "text": "All right."
    },
    {
     "op": "narrate",
     "text": "Oriel sits as close to the fire as she can get without burning, and never once turns her back on the dark."
    },
    {
     "op": "say",
     "speaker": "brannoc",
     "text": "You don't like the dark."
    },
    {
     "op": "say",
     "speaker": "oriel",
     "text": "I sleep with a candle. A priestess of the Lantern-Bearer, twenty-five years old, and I sleep with a candle.",
     "emote": "sweat"
    },
    {
     "op": "narrate",
     "text": "Brannoc unhooks the small lantern from his pack, lights it from the fire, and sets it down beside her bedroll."
    },
    {
     "op": "say",
     "speaker": "brannoc",
     "text": "I see in the dark. You keep it."
    },
    {
     "op": "say",
     "speaker": "oriel",
     "text": "Brannoc..."
    },
    {
     "op": "say",
     "speaker": "brannoc",
     "text": "Don't thank me. Just sleep."
    },
    {
     "op": "move",
     "actor": "oriel",
     "to": [
      10,
      22
     ],
     "face": "down"
    },
    {
     "op": "narrate",
     "text": "Oriel lies down beside the lantern and hums the dusk hymn under her breath until she falls asleep. Badly. Brannoc doesn't mind."
    },
    {
     "op": "time_of_day",
     "preset": "morning",
     "duration": 4.0
    },
    {
     "op": "narrate",
     "text": "Somewhere past the fourth hour, the pines go grey, then gold. The lantern is still burning beside Oriel when she wakes."
    },
    {
     "op": "say",
     "speaker": "tamsin",
     "text": "Big Man. Did you sleep at all?"
    },
    {
     "op": "say",
     "speaker": "brannoc",
     "text": "Some."
    },
    {
     "op": "say",
     "speaker": "oriel",
     "text": "He gave the last watch to the owl.",
     "emote": "smile"
    },
    {
     "op": "say",
     "speaker": "ilsevel",
     "text": "Pell says he was excellent at it. Pell says nothing happened at all, which is the point of a watch."
    }
   ]
  }
 ],
 "next_time": "Back to Brindle Cross, and an old priest's story."
}
